### ISSUE TITLE
seeing various requests on tcpdump

### ISSUE THREAD

**Issue by z0x00** [brainfucksec/archtorify#21]
On https://github.com/brainfucksec/archtorify/wiki/Security It says,
`tcpdump -n -f -p -i enp0s3 not arp and not host IP.TO.TOR.GUARD`
You are not supposed to see any output other than the first two header lines.

but i am seeing some requests and unable to figure out what they are for:

```
20:31:10.607815 IP 127.0.0.1.9040 > 192.168.5.129.36712: Flags [R.], seq 2776651472, ack 1, win 64240, length 0
20:31:16.676091 IP 192.168.5.129.36712 > 127.0.0.1.9040: Flags [S], seq 2791298890, win 64240, options [mss 1460,sackOK,TS val 1663123331 ecr 0,nop,wscale 7], length 0
20:31:18.710823 IP 127.0.0.1.9040 > 192.168.5.129.36712: Flags [R.], seq 3637849319, ack 1, win 64240, length 0
20:32:09.636929 IP 192.168.5.128.68 > 192.168.5.254.67: BOOTP/DHCP, Request from xx:xx:xx:xx:xx:xx, length 280
20:32:09.638209 IP 192.168.5.254.67 > 192.168.5.128.68: BOOTP/DHCP, Reply, length 300
20:36:01.319322 IP 192.168.5.128.49494 > 192.168.5.2.53: 21182+ A? ping.archlinux.org. (36)
20:36:01.330778 IP 192.168.5.2.53 > 192.168.5.128.49494: 21182 2/0/0 CNAME redirect.archlinux.org., A 95.216.195.133 (75)
20:36:01.331317 IP 192.168.5.129.36714 > 127.0.0.1.9040: Flags [S], seq 1393874609, win 64240, options [mss 1460,sackOK,TS val 1663407986 ecr 0,nop,wscale 7], length 0
20:36:02.354967 IP 192.168.5.129.36714 > 127.0.0.1.9040: Flags [S], seq 1393874609, win 64240, options [mss 1460,sackOK,TS val 1663409009 ecr 0,nop,wscale 7], length 0
20:36:03.370777 IP 127.0.0.1.9040 > 192.168.5.129.36714: Flags [R.], seq 1056526521, ack 1393874610, win 64240, length 0
20:36:04.465054 IP 192.168.5.129.36714 > 127.0.0.1.9040: Flags [S], seq 1393874609, win 64240, options [mss 1460,sackOK,TS val 1663411120 ecr 0,nop,wscale 7], length 0
20:36:06.508506 IP 127.0.0.1.9040 > 192.168.5.129.36714: Flags [R.], seq 366473844, ack 1, win 64240, length 0
20:36:08.515431 IP 192.168.5.129.36714 > 127.0.0.1.9040: Flags [S], seq 1393874609, win 64240, options [mss 1460,sackOK,TS val 1663415170 ecr 0,nop,wscale 7], length 0
20:36:10.568620 IP 127.0.0.1.9040 > 192.168.5.129.36714: Flags [R.], seq 355014813, ack 1, win 64240, length 0
20:36:16.624992 IP 192.168.5.129.36714 > 127.0.0.1.9040: Flags [S], seq 1393874609, win 64240, options [mss 1460,sackOK,TS val 1663423279 ecr 0,nop,wscale 7], length 0
20:36:18.662654 IP 127.0.0.1.9040 > 192.168.5.129.36714: Flags [R.], seq 1039447427, ack 1, win 64240, length 0
20:39:46.702989 IP 192.168.5.128.68 > 192.168.5.254.67: BOOTP/DHCP, Request from xx:xx:xx:xx:xx:xx, length 300
20:39:46.704161 IP 192.168.5.254.67 > 192.168.5.129.68: BOOTP/DHCP, Reply, length 305
20:39:46.704237 IP 192.168.5.129 > 192.168.5.254: ICMP 192.168.5.129 udp port 68 unreachable, length 341
20:39:50.232193 IP 192.168.5.128.68 > 192.168.5.254.67: BOOTP/DHCP, Request from xx:xx:xx:xx:xx:xx, length 300
20:39:50.232549 IP 192.168.5.254.67 > 192.168.5.129.68: BOOTP/DHCP, Reply, length 305
20:39:50.232580 IP 192.168.5.129 > 192.168.5.254: ICMP 192.168.5.129 udp port 68 unreachable, length 341
20:39:58.902329 IP 192.168.5.128.68 > 192.168.5.254.67: BOOTP/DHCP, Request from xx:xx:xx:xx:xx:xx, length 300
20:39:58.902769 IP 192.168.5.254.67 > 192.168.5.129.68: BOOTP/DHCP, Reply, length 305
20:39:58.902798 IP 192.168.5.129 > 192.168.5.254: ICMP 192.168.5.129 udp port 68 unreachable, length 341
20:40:15.029119 IP 192.168.5.128.68 > 192.168.5.254.67: BOOTP/DHCP, Request from xx:xx:xx:xx:xx:xx, length 300
20:40:15.029731 IP 192.168.5.254.67 > 192.168.5.129.68: BOOTP/DHCP, Reply, length 305
20:40:15.029780 IP 192.168.5.129 > 192.168.5.254: ICMP 192.168.5.129 udp port 68 unreachable, length 341
```
Is this normal?

I do have a tor browser running though.

**Comment by brainfucksec** [comment]
(I removed the MAC addresses from the output).
I need to run tests on this to be able to answer you fully, anyway connections are probably related to your network configuration.

**Comment by z0x00** [comment]
@brainfucksec thanks for the MAC.
it is a regular version of Arch Linux.
should i use a firewall? i generally use ufw with this settings [https://askubuntu.com/questions/1005312/ufw-firewall-deny-outgoing-but-allow-browser](https://askubuntu.com/questions/1005312/ufw-firewall-deny-outgoing-but-allow-browser)
but currently ufw seems inactive. Will using ufw with above settings affect `archtorify`?

**Comment by brainfucksec** [comment]
archtorify sets iptables rules, so any firewall or DNS-related applications must be disabled, see: [How to run archtorify](https://github.com/brainfucksec/archtorify/wiki/Usage#how-to-run-archtorify).

From the `ss` command output the Tor guard IP is the IP address under the `PEER` entry, I ran the test now and there is no connection in the output, the test should be performed without any browser open or application making network connections. 
As stated in the README, Arch linux users have Network configurations that vary widely, I would need to know how yours is configured (whether with `dhcpcd`, `systemd-networkd` etc.).
